Manuscript ID,Manuscript Title,Manuscript Type,Author Names,Submission Date,Published after
RCSJ-2016-0444,Design of Hand Held Doppler: A Potential Source of Contamination!!,Original research – Annals (clinical),"Sultan, Muhammad; Sathanantham, Kugili; Lumley, Rebecca; Vowden, Peter",2016,2015
RCSJ-2016-0446,Critiquing Operative Fracture Fixation: The Development of an Assessment Tool,Original research – Bulletin (non-clinical),"Hawkes, David; Harrison, James",2016,2015
RCSJ-2016-0448,Lymphangiogenesis and colorectal cancer: a review,Review articles,"Chen, Yigang",2016,2015
RCSJ-2016-0449,An alternative differential diagnosis for swellings in the head and neck: Immune Reconstitution Inflammatory Syndrome (IRIS) in patients receiving highly active anti-retroviral therapy (HAART).,Case reports,"Fenesan, Stephanie; Stagnell, Sami; Morton, Alistair",2016,2015
RCSJ-2016-0451.R3,Early Results of a Modified Induced Membrane Technique in the Management of Traumatic Bone Loss in the Lower Limb: A Cohort Study,Original research – Annals (clinical),"Giotikas, Dimitrios; Spalding, Lynette; Nabergoj, Marko; Krkovic, Matija",2016,2015
RCSJ-2016-0452,Giant retroperitoneal liposarcoma penetrating into scrotum: A case report,Case reports,"Huang, Kang; Yang, Li; Wang, Hui; Wang, Lei",2016,2015
RCSJ-2016-0454,Surgery in late melanoma adrenal metastasis,Case reports,"Di Martino, Marcello; Valdes de Anca, Alvaro; Mora-Guzmán, Ismael; de la Hoz Rodríguez, Angela; Rodríguez Sánchez, Ana; García-Sanz, Iñigo",2016,2015
RCSJ-2016-0455,Intractable sinus – a rare complication after splenectomy,Case reports,"Shrestha, Badri; Hampton, James",2016,2015
RCSJ-2016-0458,Subcutaneous Suture,Technical papers,"Sahni, Vaibhav",2016,2015
RCSJ-2016-0460,Large polypoidal lesion:  A rare presentation of Solitary Rectal Ulcer Syndrome,Case reports,"MERALI, NABEEL; Yousuff, Mehreen.; Lynes, Kathryn; Akhtar, Mansoor",2016,2015
RCSJ-2016-0461,Radiofrequency energy applications in the Specialty of Pediatric Surgery,Review articles,"Asimakidou, Maria; Oikonomou, Louiza; Philipopoulos, Antonios; Petropoulos, Anastasios",2016,2015
RCSJ-2016-0462,Using a “Double Wax Hook” to remove friable paediatric nasal foreign bodies.,Technical papers,"Chan, Michael; Fu, Bertram",2016,2015
RCSJ-2016-0464,Changes to NICE referral guidelines for suspected colorectal cancer: How may this affect referral numbers and service provision?,Original research – Annals (clinical),"Hughes, Jane; MacDonald, Siobhan; Wilson, Scott; Duff, Sarah",2016,2015
RCSJ-2016-0465,"Egg white and milk protein allergy manifesting as rhinitis and otitis media 
",Case reports,"Haywood, Matthew; Alade, Adebayo; Vijendren, Ananth; Singh, Pranay",2016,2015
RCSJ-2016-0466,A case report on a rare presentation of Solitary Rectal Ulcer Syndrome,Case reports,"MERALI, NABEEL; Yousuff, Mehreen.; Lynes, Kathryn; Akhtar, Mansoor",2016,2015
RCSJ-2016-0468,Pyloric obstruction due to gastric bezoar: 3D laparoscopic-assisted removal of bezoar,Case reports,"Dai, Yong; Dong, Jin; Qin, Wei",2016,2015
RCSJ-2016-0469,Pre- and post-operative hypomagnesaemia and correlation with adverse outcomes in elective vascular surgery,Original research – Annals (clinical),"Sillo, Toritseju; Ahmad, Mehtab; Becker, Helga; Garnham, Andrew; Wall, Michael",2016,2015
RCSJ-2016-0470,A simple technique for the unplanned adjustment of an external fixator,Technical papers,"Jayasekera, Narlaka; rayner, michael; Platt, Simon",2016,2015
RCSJ-2016-0471,Renal cyst rupture following blunt abdominal trauma: case report.,Case reports,"Balcombe, Toby; König, Thomas",2016,2015
RCSJ-2016-0472,Guerin's Sign,Case reports,"Sahni, Vaibhav",2016,2015
RCSJ-2016-0474,The Buried Horizontal Mattress Suture for Closure of Liposuction Cannula Stab Incisions,Technical papers,"Biddlestone, John; Weiler-Mithoff, Eva; Chew, Ben",2016,2015
RCSJ-2016-0478,Eversion versus patch carotid endarterectomy in management of carotid stenosis: a meta-analysis of randomized controlled studies,Review articles,"chen, ping; wang, zhanfeng; Han, Hailing; Miao, Zhuang",2016,2015
RCSJ-2016-0479,Semi-Closed Vs. Karydakis method  for the treatment of pilonidal sinus disease,Original research – Annals (clinical),"ElGohary, Hatem; Elabbassy, Islam",2016,2015
RCSJ-2016-0480,Experience and outcome data of the British Non-Arthroplasty Hip Registry ,Original research – Annals (clinical),"Humphrey, Joel; George, Marc; Bankes, Marcus",2016,2015
RCSJ-2016-0481,The preventable never event - preoperative pregnancy testing not fit for purpose: a case report,Case reports,"Clement, Keiran; Luhmann, Andreas; Wilson, Michael; Patil, Pradeep",2016,2015
RCSJ-2016-0482,Novel technique to facilitate wound closure in oedematous tissues using sterile crepe dressing,Technical papers,"Henry, Nader; Siddiqui, Nashat",2016,2015
RCSJ-2016-0483,MONTAGGIA TYPE 4 FRACTURE -A case report of an unusual presentation of a rare injury.,Case reports,"Athar, sajjad; Ashwood, Neil",2016,2015
RCSJ-2016-0484.R1,A multicentre study of amputation practices across the United Kingdom,Original research – Annals (clinical),"Milinis, Kristijonas; Thapar, Ankur; Dindyal, Shiva; Bosanquet, Dave; Stimpson, Amy; Barnes, Rachel; Goodyear, Steve; Patel, Shaneel; Stather, Philip",2017,2015
RCSJ-2016-0485,Surgical oncology practice in low income countries; difficulties and practical solutions,Original research – Bulletin (non-clinical),"Metwally, Islam",2016,2015
RCSJ-2016-0486,A case of unusual metastasis from a rather common carcinoma,Case reports,"Athar, sajjad; Ashwood, Neil; rao, vijesh",2016,2015
RCSJ-2016-0487,Buried in Bone: Dealing with Prominent K-wires,Technical papers,"Rehman, Haroon; Gardner, Timothy; Mcmillan, Tristan; Stevenson, Iain",2016,2015
RCSJ-2016-0488,"Incidental Mesenteric Paraganglioma: a case report and literature review
",Case reports,"Mahapatra, Roy; Fok, Matthew; Exarchou, Klaire; Cameron, Fraser; Vimalachandran, Dale",2016,2015
RCSJ-2016-0489,Using the “Stethoscope Test” to identify true involuntary guarding,Technical papers,"Rufai, Sohaib; Hamami, Heba; Devoto, Laurence",2016,2015
RCSJ-2016-0491,Trainee Appendicectomies,Original research – Annals (clinical),"Gordon, Andrew; Lupi, Micol; Hassam, Mohammed Zafir; Vig, Stella",2016,2015
RCSJ-2016-0492,Minimising Pre-Operative Starvation Times in Patients with Neck of Femur Fractures ,Original research – Annals (clinical),"Oakley, Ben; Duggleby, Luke; Raglan, Martin; Ollivere, Benjamin",2016,2015
RCSJ-2016-0493,Optimum Level of Vessel Ligation in Splenic Flexure Cancer,Original research – Annals (clinical),"Al Bandar, Mahdi; Han, Yoon Dae; Al Sabilah, Jamal; cho, Min Soo; Hur, Hyuk; Min, Byung Soh; lee, Kang Young; kim, Nam Kyu",2016,2015
RCSJ-2016-0494,"Declining applications to surgical specialist training, when should we worry? .",Original research – Bulletin (non-clinical),"Green, Richard; Steven, Richard; Haddow, Kerry",2016,2015
RCSJ-2016-0495,Current standard of basic laparoscopic skills training amongst foundation doctors in the UK – A Multi Centre Analysis ,Original research – Bulletin (non-clinical),"ranjit, srinath; Rashid, Farhan; Lorenzi, Bruno; Charalabopoulos, Alexandros",2016,2015
RCSJ-2016-0496,A life threatening pain in the leg,Case reports,"Golding, David; Lee, Paul",2016,2015
RCSJ-2016-0498.R1,How do Major Trauma Centres staff their rotas without compromising surgical training time? A survey of UK adult trauma centres.,Original research – Bulletin (non-clinical),"Dimock, Richard; Dawe, Edward; Stone, Andy; Bendall, Stevan; Solan, Matthew; Ricketts, David",2016,2015
RCSJ-2016-0499,Total Colectomy and Ileorectal Anastomosis: Is Defaecatory Function Better After Laparoscopic Surgery?,Original research – Annals (clinical),"Khan, Muhammad; Saunders, Rick",2016,2015
RCSJ-2016-0500,"What Is the Best Treatment of Giant Cell Tumor of Distal Radius with Limited Soft Tissue Invasion? 
Intralesional Curettage & Cementing versus Wide En bloc Excision
",Original research – Annals (clinical),"Mozaffarian, kamran; Modjallal, Mehra; Vosoughi, Amir",2016,2015
RCSJ-2016-0501,Case report: Re-fracture of a paediatric forearm around an overgrown plate – a new and effective technique of achieving fixation,Case reports,"Bradley, Ben; O'Mahony, Canice; Wilson, Matthew",2016,2015
RCSJ-2016-0503,Stapled bowel anastomosis: A technical tip.,Technical papers,"Harrison, Sanjay; Benziger, Harrison; SRINIVASAIAH, NARASIMHAIAH",2016,2015
RCSJ-2016-0504,"POSTOPERATIVE PERITONITIS AFTER SUPRA MESOCOLIC SURGERY: MANAGEMENT, MORBIDITY AND OUTCOME.",Original research – Annals (clinical),"bensignor, thierry; Lefevre, jeremie; Chafai, Najim; Lescot, Thomas; Hor, Thevy; paye, francois; balladur, pierre; tiret, emmanuel; parc, yann",2016,2015
RCSJ-2016-0506,A 21st Century surgical training pathway?,Original research – Bulletin (non-clinical),"Newton, Nick; Sharrock, Anna",2016,2015
RCSJ-2016-0508,ASSOCIATION OF NON ALCOHOLIC FATTY LIVER DISEASE (NAFLD) AND METABOBIC SYNDROME WITH GALL STONE DISEASE,Original research – Annals (clinical),"BALOCH, QAMARUDDIN; Ahmed, Farah",2016,2015
RCSJ-2016-0509,Central Pancreatectomy for Solid Pseudopapillary Neoplasm: Report of a Case,Case reports,"Alqassieh, Ahmad; Alimoglu, Orhan; Ziadat, Abdelaziz; Abu-Abeeleh, Mahmoud; Mahseeri, Mohamad; Halbony, Hala",2016,2015
RCSJ-2016-0510,A case of large neurilemmoma with cystic degeneration arising from ganglion of lingual nerve in the left submandibular gland and its treatment,Case reports,"Bhat, Lakshminarayan; Rout, Tapas; Panda, Saroj; Sahoo, Mamata",2016,2015
RCSJ-2016-0512,Management of human ‘fight’ bites at Leeds Teaching Hospitals NHS Trust: education is needed.,Original research – Annals (clinical),"Stallard, Joseph; Edler, Sophie; Wilks, Daniel; Pinder, Richard; Smith, Ian",2016,2015
RCSJ-2016-0514,"An acetate buffered crystalloid infusate versus infusion of 0.9% saline and hemodynamic stability in patients undergoing renal transplantation: a prospective, randomized, controlled trial",Original research – Annals (clinical),"Pfortmueller, Carmen; Funkt, Georg; Potura, Eva; Reiterer, Christian; Luf, Florian; Kabon, Barbara; Druml, Wilfred; Fleischmann, Edith; Lindner, Gregor",2016,2015
RCSJ-2016-0515,Recognising and dealing with complications in orthopaedic surgery,Review articles,"Ricketts, David; rogers, benedict; Roper, Tom; Ge, Xingtao",2016,2015
RCSJ-2016-0516,Non absorbable suture should be avoided when operating on the biliary tree,Technical papers,"Kirby, George; Perry, Anthony",2016,2015
RCSJ-2016-0517,Adult pancreatic hemangioma: A rare case report and literature review,Case reports,"Zou, Heng; Wang, Xiao-Wei; Miao, Xiong-Ying; Huang, Sheng-Fu; Li, Qing-Long; Wen, Yu",2016,2015
RCSJ-2016-0518,Para-umbilical Littre hernia: An unsuspecting cause of intestinal obstruction,Case reports,"Sha, Hon Leong",2016,2015
RCSJ-2016-0522,"
Patient survey results of laparoscopic appendicectomy for non inflamed appendix, when no other cause of abdominal pain is found",Original research – Annals (clinical),"Aryal, Kamal; Limbu, Raju; Ojukwu, Nonny",2016,2015
RCSJ-2016-0526,Traumatic penile amputation: A case of failed microsurgical repair. ,Case reports,"Patial, Tushar; Sharma, Girish",2016,2015
RCSJ-2016-0527,The efficacy of chewing gum in colorectal surgery: a systematic literature review and meta-analysis,Review articles,"liu, tongjun; Bai, bin; Zhang, kai; Li, chunsheng",2016,2015
RCSJ-2016-0528,Transport Perfusion Fluid from Kidney and Simultaneous Pancreas Kidney Transplants,Original research – Annals (clinical),"Taylor, Claire; Tabbakh, Yasmin; Van Nispen tot Pannerden, Claire; Yershov, Danylo; Kessaris, Nicos; Loukopoulos, Ioannis; Mamode, Nizam; Olsburgh, Jonatho",2016,2015
RCSJ-2016-0529,WHITE BLOOD CELL AND PLATELET INDICES IN THYROID CANCER,Original research – Annals (clinical),"Machairas, Nikolaos; Kostakis, Ioannis; Prodromidou, Anastasia; Stamopoulos, Paraskevas; Feretis, Themistoklis; Garoufalia, Zoi; Damaskos, Christos; Tsourouflis, Gerasimos; Kouraklis, Gregory",2016,2015
RCSJ-2016-0530,Predictors of Intra-Operative Fractures During Hemiarthroplasty For The Treatment Of Fragility Hip Fractures,Original research – Annals (clinical),"Aslam-Pervez, Nayef; Hossain, Fahad; Riaz, Osman; Gopal, Shivkumar",2016,2015
RCSJ-2016-0531,"Treatment of prolapsing hemorrhoids in HIV-infected patients with tissue-selecting technique 
",Original research – Annals (clinical),"fan, zhe; zhang, yi",2016,2015
RCSJ-2016-0532, Acute pancreatitis following a single dose of codeine phosphate: A case report,Case reports,"Obeid, Noor; King, Ian; Fletcher, Lucy",2016,2015
RCSJ-2016-0534,The role of canine olfaction in malignant melanoma detection: an exemplar and review of the literature,Case reports,"Bechar, Janak; Hardwicke, Joseph; Jaffe, Wayne",2016,2015
RCSJ-2016-0536,CHALLENGES IN PARATHYROID CANCER: A REVIEW,Review articles,"Wijerathne, Sujith; Nga, Min En; Parameswaran, Rajeev",2016,2015
RCSJ-2016-0537,Circular fixator and bone tumours,Original research – Annals (clinical),"Ahmed-Kamel, Sherif; Abdel Rahman, Mohamed; Abou Seif, Salah",2016,2015
RCSJ-2016-0538,IMPROVING OUTCOMES OF EMERGENCY BOWEL SURGERY AT A TERTIARY CARE CENTRE IN A DEVELOPING COUNTRY; USING NELA MODEL,Original research – Annals (clinical),"Sultan, Rizwan; Zafar, Hasnain",2016,2015
RCSJ-2016-0539,Open Reduction and Internal Fixation Of Posterior Fracture Dislocation Of The Shoulder Made Easy!,Technical papers,"Saadat, Waqar; Monga, Puneet",2016,2015
RCSJ-2016-0541,It’s all in the history: a concealed cause of lumbosacral plexopathy,Case reports,"Jackson, John; Webb, Jason; Bigsby, Ewan",2016,2015
RCSJ-2016-0542,A trick for removing surgical drains,Technical papers,"Huang, Xu-Chen; Hu, Xu-Hua; Wang, Gui-Ying",2016,2015
RCSJ-2016-0543,"Experience of the posterior lip augmentation device in a regional hip arthroplasty unit
",Original research – Annals (clinical),"Hoggett, Lee; Cross, Charlotte; Helm, Tony",2016,2015
RCSJ-2016-0544,Quality Indicators for Sentinel Lymph Node Biopsy in Breast Cancer: Applicability and Clinical Relevance in a non-screened population,Original research – Annals (clinical),"Agrawal, Sanjit; Shenoy, Sachin; Arun, Indu; Chatterjee, Sanjoy; Roy, Soumendranath; Nalawade, Nikhil; Datta, Soumitra; Ahmed, Rosina",2016,2015
RCSJ-2016-0545,Colonoscopic Deroofing: A Good Option for Cystic Lymphangioma of Colon,Case reports,"Karmaker, Avik; Akram, Warqaa; Wallack, Marc; Mariadason, James",2016,2015
RCSJ-2016-0547,Evaluating the Value of Peer Assessment of Orthopaedic Lecture Teaching by Foundation Doctors – by qualitative and quantitative methods,Original research – Bulletin (non-clinical),"Athar, sajjad; Ashwood, Neil; galnopolous, ilias; karagkevekis, Babis",2016,2015
RCSJ-2016-0548,Dual use of an Arterio-Venous Fistula for Total Parentral Nutrition and Haemodialysis: Potential and Pitfalls.,Case reports,"Kirby, George; Meecham, Lewis; Leslie, Fiona; Asquith, John; Wessels, Julie; Pherwani, Arun",2016,2015
RCSJ-2016-0549,"The Direct Posterior Approach (DPA) to the Hip Allows Sparing of the Piriformis and Obturator Internus in a Modified Posterior Approach
",Original research – Annals (clinical),"Hanly, Richard; Sokolowski, Sabrina; Timperley, Andrew",2016,2015
RCSJ-2016-0550,30 days Readmission after General Surgical Procedures; can we reduce the rate?,Original research – Annals (clinical),"Sultan, Rizwan; Abdullah, Umme Hani; chawla, tabish",2016,2015
RCSJ-2016-0551,An Unusual finding in Mohs Surgery: Follicular Lymphoma,Case reports,"Defty, Charlotte; Krishna, Yamini; Sharma, Naveen; Tehrani, Hamid",2016,2015
RCSJ-2016-0553,The cadaveric anatomy of the dorsal wrist approach: risk of injury to neurovascular structures,Original research – Annals (clinical),"Ahmad, Zafar; Parkar, Asif; Feigl, George; Grechenif, Stephan; Grechenig, Wolfgang; Ang, Swee",2016,2015
RCSJ-2016-0554,"Effect of reinforced audit and feedback intervention on physician behavior: a multifaceted strategy for targeting medical record documentation triangle (MRDT) 
",Original research – Annals (clinical),"meidani, zahra",2016,2015
RCSJ-2016-0555,T-CELL/HISTIOCYTE RICH B-CELL LYMPHOMA OF SPLEEN: A CASE REPORT,Case reports,"sarangi, anshuman; Panda, Srikanta; Tirkey, Roshni",2016,2015
RCSJ-2016-0558,Spectrum of parathyroid surgery in primary hyperparathyroidism: an experience from Eastern India ,Original research – Annals (clinical),"Roy, Souvik; Chakraborty, Abhijit; Sinha, Amit",2016,2015
RCSJ-2016-0559,"Sentinel Lymph Node Biopsy for Breast Ductal Carcinoma in Situ: Waste of Time, Money and Resources ",Original research – Annals (clinical),"Sarma, Diwakar; Mahendran, Balaji; Clarkson, Lucy; Hyett, Elaine; Ramzi, Saed",2016,2015
RCSJ-2016-0560,Loss of shoulder function following pectoralis major myocutaneous flap transfers in a patient with undiagnosed massive bilateral rotator cuff tears,Case reports,"Fine, Nicola; Woodacre, Timothy",2016,2015
RCSJ-2016-0561,Unusual case of bile duct injury by harmonic scalpel,Case reports,"panneer selvam, prabusankar",2016,2015
RCSJ-2016-0564,Treatment of Fistula in Ano with Fistula Plug: Experience of a Tertiary Care Centre in South Asia.,Original research – Annals (clinical),"Almeida, Isuru; Samarasekera, Dharmabandhu",2016,2015
RCSJ-2016-0565,The Use of Bladder Syringe for Cement Application in Total Knee Arthroplasty,Technical papers,"Abdul-Jabar, Hani; Menzalji, Maher",2016,2015
RCSJ-2016-0566,A novel technique for minimally invasive removal of plates and screws. ,Technical papers,"Ricketts, David; Ge, Xingtao",2016,2015
RCSJ-2016-0567,Neuroendocrine tumour of the kidney complicated by spontaneous rupture. ,Case reports,"Barreto, Lenka; Arora, Ajay; Norton, Jane; Al Musbahi, Abdussalam",2016,2015
RCSJ-2016-0569,Resection of ano-rectal GIST using TEO platform: a report of two cases and review of literature,Case reports,"Eldamshety, Osama; Metwally, Islam; Ghoneem, Elsayed; Elkashef, Wagdi",2016,2015
RCSJ-2016-0570,Clinical Variation in Practice of Cholecystectomy and Surgical Outcomes: Challenges in Small Hospitals,Original research – Annals (clinical),"Khan, Muhammad; Khan, Raja",2016,2015
RCSJ-2016-0571,Current service provision and practice for interventional radiology in traumatic blunt splenic injury across the Regional Trauma Networks of England ,Original research – Annals (clinical),"Hughes, Jane; Scrimshire, Ashley; Steinberg, Laura; Yiannoullou, Petros; Newton, Katy; Pearce, Lyndsay; Hall, Claire; Macdonald, Andrew",2016,2015
RCSJ-2016-0573.R1,Is an Ankle Fracture Just and Ankle Fracture? ,Original research – Annals (clinical),"Shelton, James; Whittam, David; Doorgakant, Ashtin; Argyropoulos, Miltos; Dorman, Sara; Wood, Edward",2017,2015
RCSJ-2016-0575,Royal College of Surgeons Summer Program in Anatomy and Practical Skills for Medical Students - Review,Review articles,"Fogel, Nicole",2016,2015
RCSJ-2016-0576,"Debridement, Antibiotics and Implant retention (DAIR) for prosthetic joint infections. Clinical and cost efficacy. ",Original research – Annals (clinical),"Heng, Sieh; Agarwal, Sanjeev",2016,2015
RCSJ-2016-0578,Management of Recurrent Temporo-Mandibular Joint Dislocation,Technical papers,"Chandegra, Rohit; Hanu-Cernat, Liviu",2016,2015
RCSJ-2016-0579,Raising the bar for laparoscopic anti-reflux surgery – a 10 year experience from a high volume unit,Original research – Annals (clinical),"Mistry, Pritesh; Zaman, Shafquat; Shapey, Iestyn; Daskalakis, Markos; Nijjar, Rajwinder; Richardson, Martin; Super, Paul; Singhal, Rishi",2016,2015
RCSJ-2016-0580,"A novel simulation technique for suprapubic catheter insertion
",Technical papers,"Brown, Chris; Ansell, James; Abdelrahman, Tarig; Egan, Richard; Warren, Neil; Lewis, Wyn",2016,2015
RCSJ-2016-0581,"A NEVER EVENT IN CASE OF TRAUMA: TENSION HEMOTHORAX

",Case reports,"HARIHARAN, SHYAM; Mukherjee, Ramanuj; HALDER, SUBHADIP; SINGH, SUDIPTA",2016,2015
RCSJ-2016-0582,Vestibular Schwannoma appears to be very rare in South- East Nigeria ,Original research – Annals (clinical),"Ohaegbulam, Samuel; Okwuoma, Okwunodulu; Ndubuisi, Chika; Mezue, Wilfred; Orji, Benedict; Iroegbu, Linda; Nkwerem, Patrick; Ekuma, Michael",2016,2015
RCSJ-2016-0583,Transanal resection of post anastomotic rectal stricture by a circular stapling device – A novel method,Case reports,"Ahmed, Nadeem; Dhaduk, Vimalkumar; Reddy, Prasnna",2016,2015
RCSJ-2016-0584,LAPAROSCOPIC REVERSAL OF HARTMANN’S PROCEDURE (eLapRHP): Technical Tips,Technical papers,"Bagul, ANIL; Shrotri, Milind",2016,2015
RCSJ-2016-0586,Effects of hip arthrography with iodinated contrast agents on bacterial growth,Original research – Annals (clinical),"Assiotis, Angelos; Kidd, Stephen; Cortes, Nick; Pengas, Ioannis",2016,2015
RCSJ-2016-0587,Conquering The Deadly Stroke –A Surgeon’s Odyssey,Case reports,"Aryal, Bibek; Komokata, Teruo; Imoto, Yutaka",2016,2015
RCSJ-2016-0588,"Addressing DNACPR (do not attempt cardio-pulmonary resuscitation) in patients with a fractured neck of femur who lack capacity.


",Review articles,"Hill, Daniel; Bazaar, Laura; Freudmann, Matthew",2016,2015
RCSJ-2016-0592,LAPAROSCOPIC APPENDICECTOMY IN PATIENTS WITH A MACROSCOPICALLY NORMAL APPENDIX. RESULTS OF A SINGLE CENTRE AND REVIEW OF LITERATURE.,Original research – Annals (clinical),"Zosimas, Dimitrios; Lykoudis, Panagis; Pilavas, Andreas; Burke, Joshua; Strano, Giuseppe; Shatkar, Veerana",2016,2015
RCSJ-2016-0594,"Do Short Cephalomedullary Nails in intertrochanteric fractures with loss of medial buttress allow weight bearing without mechanical complications? 
",Original research – Annals (clinical),"Pearce, Oliver; Vivona, Jean; Flecher, Xavier; Parratte, Sebastian; SANAULLAH, AABID; Argenson, Jean",2016,2015
RCSJ-2016-0595,Soft tissue balancing in primary total hip arthroplasty: a series of 100 consecutive patients,Original research – Annals (clinical),"Memarzadeh, Arman; Arvinte, Dan; Sood, Manoj",2016,2015
RCSJ-2016-0597,Different successful management strategies for obstructing renal parapelvic cysts,Case reports,"Rossi, Sabrina; Koo, Brendan; Riddick, Antony; Shah, Nimish; Stewart, Grant",2016,2015
RCSJ-2016-0598,Improving Orthopaedic Operation Notes and Post-Operative Instructions at a Major UK Teaching Hospital,Original research – Annals (clinical),"Matthews, Jacob; Farrar, Edmund; Rickard, Lloyd; Sales, Adam; Clarke, Marcus; Tadrak, Konstancja; Evans, Scott; Sargeant, Ian",2016,2015
RCSJ-2016-0599,Left-sided anterior diaphragmatic hernia presenting in adulthood: A case report,Case reports,"Proctor, Victoria; Tzvetkov, Ivaylo; Ravi, Krish",2016,2015
RCSJ-2016-0604,Follicular Thyroid Carcinoma Presenting with Pathological Fracture of the Humerus at Initial Diagnosis,Case reports,"Yang, Wanding; Cho, WaiSum; Das, Sudip; Conboy, Peter",2016,2015
RCSJ-2016-0608,A novel approach to identify the tunica vaginalis hernia sac during orchidopexy,Technical papers,"Young Sing, Quillan; Unwala, Darius",2016,2015
RCSJ-2016-0609,Bariatric Surgery for Comparing Roux-en-Y Gastric Bypass with Vertical Banded Gastroplasty: A Systematic Review and Meta-analysis of Randomized Controlled Trials,Review articles,"Geng, Hongzhi; Xu, Xin Cai; Chen, Qi Long; Xu, Yi Ke; Liu,  Bing",2016,2015
RCSJ-2016-0611,Case report: Acute confusion due to an obstructing femoral hernia,Case reports,"Afzal, Zeeshan; Adaba, Franklin; Ihedioha, Ugochukwu",2016,2015
RCSJ-2016-0612,Para spinal abscess formation as a result of spilled gallstones during laparoscopic cholecystectomy: An unusual presentation,Case reports,"Canna, Awas; Adaba, Franklin; Sezen, Ebbie; Bissett, Amanda; Finch, Guy; Ihedioha, Ugochukwu",2016,2015
RCSJ-2016-0615,"Thyroid Solitary Fibrous Tumor, a rare entity.",Case reports,"OSORIO-SILLA, IRENE; aguirregoicoa, elena; Gómez Ramirez, joaquín; reina, teresa; Tejedor, Patricia; Rivas Fidalgo, Sonia; López Rojo, Irene; Diaz Miguel, Mariano",2016,2015
RCSJ-2016-0618,THERAPEUTIC LAPAROSCOPY FROM THE START VERSUS DIAGNOSTIC LAPAROSCOPY FIRST FOR ACUTE ABDOMEN: WOULD OUTCOMES DIFFER? A SINGLE-CENTER EGYPTIAN EXPERIENCE,Original research – Annals (clinical),"Osman, Ayman; Mikhail, Sameh; Alkashty, Mohamed; Fahmy, Mohamed",2016,2015
RCSJ-2016-0619,"Idiopathic unilateral persistent hypoglossal nerve palsy – A case report and review of literature
",Case reports,"Humphreys, Sarah; Rajaram, Kartic; Chapman, Laura; Patel, Manu",2016,2015
RCSJ-2016-0621,A novel ultrasonic technique for pre-operative identification of underlying vasculature,Technical papers,"Singh, Prateush; Thapar, Ankur; Dindyal, Shiva",2016,2015
RCSJ-2016-0622,Surgical management of major bile duct injuries following laparoscopic and open cholecystectomy - a single center experience,Original research – Annals (clinical),"Toskovic, Borislav; Bilanovic, Dragoljub; Darko, Zdravkovic; Jovanovic, Milan; Mrda, Davor; Zdravkovic, Marija; Kostic, Jelena; Toskovic, Anka",2016,2015
RCSJ-2016-0623,Surgeon and patient experience of rigid sigmoidoscopy in colorectal rapid access clinic - how useful is it?,Original research – Annals (clinical),"Patel, Krashna; Sebastian, Boby; Lorejo, Emmanuel; Mishra, Amitabh",2016,2015
RCSJ-2016-0624, Balanitis Xerotica Obliterans: Has its diagnostic accuracy improved with time?,Original research – Annals (clinical),"Boksh, Khalis; Patwardhan, Nitin",2016,2015
RCSJ-2016-0629,"Cyanoacrylate Injury to the Ear Canal 
",Case reports,"Khan, Assad; Neminathan, Sinthuja; Sonsale, Anita; Dezso, Attila",2016,2015
RCSJ-2016-0633,"Accidental, non-masturbatory, non-intercourse related, self-inflicted Penile fracture: Case Report & Review of Literature:
",Case reports,"Bastianpillai, Christopher; Wang, Aijing; Kumaradevan, Jeevan; Chitale, Sudhanshu",2016,2015
